{
  "schema_version": 1,
  "cupti_run_id": "cupti_run_20260428_120000",
  "nvbit_run_id": "nvbit_run_20260428_120500",
  "drift_tolerance_ns": 5000000,
  "binary_sha256": "1111111111111111111111111111111111111111111111111111111111111111",
  "preflight_manifest_sha256": "2222222222222222222222222222222222222222222222222222222222222222",
  "launches": [
    {
      "launch_match_key": {
        "slug": "rmsnorm_fwd_bf16",
        "shape_point": "rows=1024,hidden=4096",
        "repeat_index": 0,
        "launch_index": 0,
        "kernel_signature_sha256": "0000000000000000000000000000000000000000000000000000000000000000"
      },
      "cupti_run_nvml_state": {
        "sm_clock_mhz": 1800,
        "mem_clock_mhz": 9001,
        "temp_c": 62.5,
        "power_mw": 78000,
        "throttle_reasons_bitmask": 0,
        "sample_timestamp_ns_host_monotonic": 1714305600000000000
      },
      "nvbit_run_nvml_state": {
        "sm_clock_mhz": 1810,
        "mem_clock_mhz": 9001,
        "temp_c": 63.0,
        "power_mw": 78500,
        "throttle_reasons_bitmask": 0,
        "sample_timestamp_ns_host_monotonic": 1714305900000000000
      }
    }
  ],
  "claim_scope": "measured_local"
}
